{
  "schema_version": 1,
  "pack": {
    "id": "core-block-editing-held-out-v1",
    "version": "1.0.0",
    "label": "Core block editing held-out private pack",
    "compatibility_group": "core-block-editing-v1",
    "created_at": "2026-05-29T00:00:00Z",
    "public_reference": "held-out-pack:core-block-editing-held-out-v1@1.0.0"
  },
  "boundary": {
    "storage": "private_repo",
    "public_safe_fields": ["pack_id", "pack_version", "compatibility_group", "scenario_id", "variant_family", "variant_seed", "sha256", "aggregate_outcomes"],
    "withheld_fields": ["prompt", "grader", "fixtures", "expected_artifacts", "screenshots", "replay_bundles", "private_paths"],
    "artifact_access": "sealed_hash_only",
    "public_report_policy": "aggregate_plus_hashes"
  },
  "promotion_policy": {
    "requires_benchmark_replay": true,
    "requires_aggregate_only_public_reports": true,
    "requires_version_identity": true,
    "requires_hash_locked_artifacts": true
  },
  "entries": [
    {
      "id": "block-markup-valid-semantic-blocks-held-out-v1",
      "scenario_id": "block-markup-valid-semantic-blocks-held-out",
      "parent_scenario_id": "block-markup-valid-semantic-blocks",
      "variant_family": "block-markup-valid-semantic-blocks",
      "variant_seed": "held-out-v1",
      "split_membership": "held_out_private",
      "task_contract_level": "benchmark_replay",
      "calibration_status": "calibrating",
      "version_identity": {
        "manifest_sha256": "0000000000000000000000000000000000000000000000000000000000000001",
        "prompt_sha256": "0000000000000000000000000000000000000000000000000000000000000002",
        "grader_sha256": "0000000000000000000000000000000000000000000000000000000000000003",
        "setup_sha256": "0000000000000000000000000000000000000000000000000000000000000004",
        "expected_artifacts_sha256": "0000000000000000000000000000000000000000000000000000000000000005",
        "replay_contract_sha256": "0000000000000000000000000000000000000000000000000000000000000006"
      },
      "artifacts": [
        { "name": "scenario_manifest", "kind": "json", "sha256": "0000000000000000000000000000000000000000000000000000000000000001", "sharing_level": "sealed_hash_only", "redaction_status": "sealed_hash_only" },
        { "name": "prompt", "kind": "markdown", "sha256": "0000000000000000000000000000000000000000000000000000000000000002", "sharing_level": "sealed_hash_only", "redaction_status": "sealed_hash_only" },
        { "name": "grader", "kind": "php", "sha256": "0000000000000000000000000000000000000000000000000000000000000003", "sharing_level": "sealed_hash_only", "redaction_status": "sealed_hash_only" },
        { "name": "setup", "kind": "json", "sha256": "0000000000000000000000000000000000000000000000000000000000000004", "sharing_level": "sealed_hash_only", "redaction_status": "sealed_hash_only" },
        { "name": "expected_artifacts", "kind": "json", "sha256": "0000000000000000000000000000000000000000000000000000000000000005", "sharing_level": "sealed_hash_only", "redaction_status": "sealed_hash_only" },
        { "name": "replay_contract", "kind": "json", "sha256": "0000000000000000000000000000000000000000000000000000000000000006", "sharing_level": "sealed_hash_only", "redaction_status": "sealed_hash_only" }
      ]
    }
  ]
}
